{
  "enabled": true,
  "mode": "block",
  "threshold": 45,
  "max_questions": 3,
  "checks": {
    "clarity": "nudge",
    "context": "nudge",
    "output_contract": "nudge",
    "template_contract": "block",
    "risk": "block",
    "plan_first": "block",
    "privacy": "block"
  },
  "severity_thresholds": {
    "block": "high",
    "nudge": "medium"
  },
  "telemetry": {
    "enabled": false,
    "path": ".prompt-preflight-telemetry.jsonl",
    "max_events": 1000,
    "max_bytes": 1048576,
    "retention_days": 30,
    "timestamp_mode": "exact"
  },
  "token_observability": {
    "enabled": true,
    "default_max_output_tokens": 1000,
    "estimated_retry_output_tokens": 800
  },
  "profiles": [
    {"match": "docs/prompts/research/**", "intent": "research", "mode": "block", "max_questions": 3},
    {"match": "docs/prompts/specs/**", "intent": "software", "mode": "block", "checks": {"plan_first": "block", "template_contract": "block"}},
    {"match": "docs/prompts/data-analysis/**", "intent": "data_analysis", "mode": "block"},
    {"match": "docs/prompts/presentations/**", "intent": "presentation", "mode": "nudge"},
    {"match": "docs/prompts/coding/**", "intent": "software", "mode": "block"}
  ]
}
